{
  "cdm_v": "0.1",
  "record_type": "decision",
  "record_id": "sample-decision-001",
  "time_utc": "2026-01-01T12:00:00Z",
  "entity": {
    "entity_id": "sample-entity",
    "market_domain_code": "sample.domain"
  },
  "project": {
    "project_id": "sample-project",
    "partition_id": "pp-sample"
  },
  "decision": {
    "title": "Edge-first storage policy",
    "summary": "Persist rollups and exceptions only; avoid raw telemetry storage.",
    "decision_class": "operational",
    "confidence": "high",
    "alternatives_considered": [
      "Store all raw telemetry"
    ]
  },
  "context_refs": {
    "state_snapshot_ref": "pp://sample/state/2026-01-01.json",
    "evidence_refs": []
  },
  "constraints_in_force": {
    "scope_profile_id": "scope-v0",
    "constraint_profile_id": "constraints-v0",
    "export_class": "C1",
    "energy_cap_ref": "energy_budget.json#2026-01"
  },
  "owner": {
    "decision_owner_type": "human",
    "approver_ref": "ops-lead"
  },
  "privacy": {
    "contains_personal_data": false,
    "contains_sensitive_trade_info": false
  }
}