{
  "cdm_v": "0.1",
  "record_type": "decision",
  "record_id": "example-decision-002",
  "time_utc": "2026-01-20T20:00:00Z",
  "supersedes_record_ids": [
    "example-decision-001"
  ],
  "entity": {
    "entity_id": "example-entity",
    "market_domain_code": "example.domain"
  },
  "project": {
    "project_id": "project-alpha",
    "partition_id": "pp-alpha"
  },
  "decision": {
    "title": "Adjust rollup cadence for humidity sensors",
    "summary": "Move from 15-min to 5-min rollups due to comfort compliance reporting needs; still do not persist raw 1Hz telemetry.",
    "decision_class": "operational",
    "confidence": "medium",
    "alternatives_considered": [
      "Keep 15-min rollups",
      "Persist raw telemetry for 7 days"
    ]
  },
  "context_refs": {
    "state_snapshot_ref": "pp://project-alpha/state_snapshots/2026-01-20T19:30Z.json",
    "evidence_refs": [
      "pp://project-alpha/docs/comfort_compliance_request.pdf"
    ]
  },
  "constraints_in_force": {
    "scope_profile_id": "scope-v0",
    "constraint_profile_id": "constraints-v0",
    "export_class": "C1",
    "energy_cap_ref": "energy_budget.json#2026-01"
  },
  "owner": {
    "decision_owner_type": "human",
    "approver_ref": "approver:ops-lead"
  },
  "privacy": {
    "contains_personal_data": false,
    "contains_sensitive_trade_info": false
  },
  "integrity": {
    "witness_id": "optional-wit-id",
    "hash_commitment": "optional"
  }
}